c24b8d8b948744438c810f6cb1d0637d,나리는 꽃가루에 눈이 따끔해 (아야) 눈물이 고여도 꾹 참을래 내 마음 한켠 비밀스런 오르골에 넣어두고서 영원히 되감을 순간이니까  우리 둘의 마지막 페이지를 잘 부탁해 어느 작별이 이보다 완벽할까 Love me only till this spring  오 라일락 꽃이 지는 날 good bye 이런 결말이 어울려 안녕 꽃잎 같은 안녕 하이얀 우리 봄날의 climax 아 얼마나 기쁜 일이야  Ooh ooh Love me only till this spring 봄바람처럼 Ooh ooh Love me only till this spring 봄바람처럼  기분이 달아 콧노래 부르네 (랄라) 입꼬리는 살짝 올린 채 어쩜 이렇게 하늘은 더 바람은 또 완벽한 건지 오늘따라 내 모습 맘에 들어  처음 만난 그날처럼 예쁘다고 말해줄래 어느 이별이 이토록 달콤할까 Love resembles misty dream  오 라일락 꽃이 지는 날 good bye 이런 결말이 어울려 안녕 꽃잎 같은 안녕 하이얀 우리 봄날의 clima,"My eyes are cold (My eyes get cold) I try to swallow (I swallow it) But it’s only filled with tears It’s a moment that only I can endure Is it enough to last forever between us? Let’s take the final step together, huh? I thank you for being such a perfect match My heart is beating fast I’m confessing to you, you’re a perfect match My eyes are burning brightly My eyes are fluttering (My eyes are burning brightly) Are you happy? I love you, I love you, I love you, I love you, I love you"
c24b8d8b948744438c810f6cb1d0637d,Scratch that bring it back (Shook! Shook! Ha) 네 앞에선  Glitch Mode 온몸이 고장 났어 Reload 난 어질 어질 어질 두통 또 돌고 돌아 I’m in Glitch Mode 전에 없던 Situation 너 아님 너만 Repetition Trouble trouble like a miscode 비상이 걸려 버 버퍼링이야 I’m on that Glitch Mode  엔진 Sound 위험해 겪은 적 없는 Pit a pat 네가 다가와 Whoop! The whoop! 왜 숨이 멎는데 가속도를 타는 심장 Go speeding up 이 감정은 어떤 말도 Can’t get enough  Watch me Imma be crazy 저항도 못하고 Hands up 돌이켜 놔 Into my mind 한방에 퍼지는 Ransom 왜 이래 왜 이래 왜 이건 치명적인 사태 Shutting me down 제어 불가 모두 다 Say I’m too much  네가 몰고 오는 달디단 소나기에 작,"I got the sensation, yeah! (Jingle bell, boom!) I got the sensation, yeah! (Jingle bell, boom!) I got the sensation, yeah! (Jingle bell, boom!) All I have to do is shake you up, up, down! I got the sensation, yeah! (Jingle bell, boom!) I got the sensation, yeah! (Jingle bell, boom!) All I have to do is shake you up, down!"
c24b8d8b948744438c810f6cb1d0637d,청소년 보호법에 따라 성인 인증이 필요한 콘텐츠 입니다. 성인 인증 후 이용해 주세요. 성인 인증,I need to be an alarm boy for the sake of i-is-kindness I need to be an adult for the sake of i-is-kindness I need to be an adult for the sake of i-is-kindness I need to be an adult for the sake of i-is-kindness I need to be an adult for the sake of i-is-kindness
c24b8d8b948744438c810f6cb1d0637d,보고 싶다 이렇게 말하니까 더 보고 싶다 너희 사진을 보고 있어도 보고 싶다 너무 야속한 시간 나는 우리가 밉다 이젠 얼굴 한번 보는 것 조차 힘들어진 우리가 여긴 온통 겨울 뿐이야 8월에도 겨울이 와 마음은 시간을 달려가네 홀로 남은 설국열차 니 손 잡고 지구 반대편까지 가 겨울을 끝내고파 그리움들이 얼마나 눈처럼 내려야 그 봄날이 올까 Friend 허공을 떠도는 작은 먼지처럼 작은 먼지처럼 날리는 눈이 나라면 조금 더 빨리 네게 닿을 수 있을 텐데 눈꽃이 떨어져요 또 조금씩 멀어져요 보고 싶다 보고 싶다 보고 싶다 보고 싶다 얼마나 기다려야 또 몇 밤을 더 새워야 널 보게 될까 널 보게 될까 만나게 될까 만나게 될까 추운 겨울 끝을 지나 다시 봄날이 올 때까지 꽃 피울 때까지 그곳에 좀 더 머물러줘 머물러줘 니가 변한 건지 니가 변한 건지 아니면 내가 변한 건지 내가 변한 건지 이 순간 흐르는 시간조차 미워 우리가 변한 거지 뭐 모두가 그런 거지 뭐 그래 밉다 니가 넌 떠났지만 단 하루도 너를 잊은,"I miss you, I miss you more I miss you more I miss you, I miss you more I’m just going to see you again when we see each other I guess our times are too tiring now Even winter is just around the corner now The winter storm has already passed I will take you there My heart, it’s only winter, I need to go to you Even winter is just around the corner now The storm has already passed I will take you there My heart, it’s only winter, I need to go to you Even winter is just around the corner now The storm has already passed I will take you there My heart, it’s only winter, I need to go to you Even winter is just around the corner now The storm has already passed I will take you there My heart, it’s only winter, I need to go to you Even winter is just around the corner now The storm has already passed I will take you there My heart, it’s only winter, I need to go to you Even winter is just around the corner now The storm has already passed I will take you there My heart, it’s only winter, I need to go to you Even winter is just around the corner now The storm has already passed I will take you there My heart, it’s only winter, I need to go to you Even winter is just around the corner now The storm has already passed I will take you there My heart, it’s only winter, I need to go to you Even winter is just around the corner now The storm has already passed I will take you there My heart, it’s only winter, I need to go to you Even winter is just around the corner now The storm has already passed I will take you there My heart, it’s only winter, I need to go to you Even winter is just around the corner now The storm has already passed I will take you there My heart, it’s only winter, I need to go to you Even winter is just around the corner now"
c24b8d8b948744438c810f6cb1d0637d,Oh my gosh! Don't you know I’m a Savage? I’m a Killa 너를 깰 ae 아직도 가리고 환각을 펼친 너 팰라 We Holler 두렵지 않아 너 너 Hit you harder  날 밀어 넣어 Deep fake on me 준비가 안된 무대로 몰아넣어 Fake on me Got everybody mock up to me 수치를 느끼게 멘탈을 흔들어놔 싸늘한 관중 무너져 ae 더는 널 못 참아 Say No!  두고 봐 난 좀 Savage 너의 Dirty 한 Play 더는 두고 볼 수 없어 나를 무너뜨리고 싶은 네 환각들이 점점 너를 구축할 이유가 돼 I’m a Savage 널 부셔 깨 줄게 Oh I’m a Savage 널 짓밟아 줄게 Oh  Get me get me now Get me get me now (Zu Zu Zu Zu) 지금 나를 잡아 아님 난 더 Savage (Zu Zu Zu Zu) Get me get me now Get me get me now (Zu Zu Zu,"Oh! Oh! Oh! See! Yeah! See! See! See! See! See! See! You! Still! Conceal, never! You! Keep! Keep! Holding! You! Can't conceal! You! Swing! And pin! You! Spin! You! Can't even count! Oh! Oh! Oh! Oh!"
c24b8d8b948744438c810f6cb1d0637d,너를 사랑하고 있어 너를 사랑하고 있어 자기야 날 사랑해주면 안 될까 말처럼 쉽지는 않은 걸 알지만 세게 날 안아주면 안 될까 오늘따라 세상이 무섭단 말이야 잠깐 인공호흡을 해주라 왠지 숨이 잘 안 쉬어져서 난 날 놓을 거면 과거에 놔주라 네가 있는 시간에서 죽어갈 거야 우리 그냥 결혼하면 안 될까 돈은 내가 열심히 벌 테니까 이 세상과 내가 눈감는 날 까지만 날 사랑한다 말해주라 내가 너를 사랑해도 네가 날 안 사랑해도 우린 나름대로 행복할 거야 내 방 천장에 그려 본 내 우주에게 물어본 말은 나를 사랑하면 안 될까 오사카나 오키나와의 바다 내 뮤비들을 찍었던 곳 말이야 같이 가자 약속했었잖아 그 약속이 깨질까 봐 겁이 나 WHUTUF이 결혼한다 하던 날 진짜 처음으로 걔가 부럽더라 하얀 웨딩드레스를 입은 아름다운 너와 영원을 말할 수 있을까 가족이 되어주라 내 집이 되어주라 나도 날 줄 테니 너도 널 주라 평생의 연인이야 네 말대로 말이야 그래 별과 우주잖아 날 사랑하지 않는다면 나의 사랑 반을 받아,"I love you, I love you, Can't you love me as much as you do? Can't you love me as much as you do? The world is so scary today Can't you hug me so tight? Let me take a break and let you go While you're in the past When we were together, I would kill you If you don't love me, I'd just give you my heart If you don't love me, I'd just give you my love I love you, Can't you love me as much as you do? The world is so scary today Can't we love me, I'd just give you my love"
c24b8d8b948744438c810f6cb1d0637d,우연히 너를 만나서 너의 옆자리에 앉아 그렇게 우린 친해졌어 짧은 시간에 그렇게 가까워질 수 있다는 게 그게 참 신기했어 소소한 일상부터 어린 시절 얘기까지도 그리 똑같진 않아도 말이 참 잘 통해서 더 짧았던 거야 너의 번호를 누르고 설레임을 가득 채우다 너의 번호를 지우며 좋았던 시간을 덜어내 그때 난 왜 몰랐을까 이뤄질 수 없는 짧은 시간 속의 우린 여기까지인가 봐 어쩌다 먼 훗날에 그때 우리 약속 기억날까 아쉬움만 가득했던 그때 난 왜 그랬을까 너의 번호를 누르고 설레임을 가득 채우다 너의 번호를 지우며 좋았던 시간을 덜어내 그때 난 왜 몰랐을까 이뤄질 수 없는 짧은 시간 속의 우린 여기까지인가 봐 아무 일 없이 살다 보면 모두 잊혀질 거라 또 맘을 속이고 달래도 자꾸만 그때 네가 생각나 또 너를 부르게 돼 너의 번호를 누르고 설레임을 가득 채우다 너의 번호를 지우며 좋았던 시간을 덜어내 그때 난 왜 몰랐을까 이뤄질 수 없는 짧은 시간 속의 스쳐 가버린 그때 그 시절 속의 우린 여기까지인가 봐,We met up together and were introduced to you We had a good time together So it became a good memory So even though it wasn't like that Our young memories are so brief Even though they aren't as good as before Even though they aren't as good as before They aren't as good as before They aren't as good as before They aren't as good as before They aren't as good as before They aren't as good as before
c24b8d8b948744438c810f6cb1d0637d,"You, you are my universe and I just want to put you first And you, you are my universe, and I…  In the night I lie and look up at you When the morning comes I watch you rise There’s a paradise they couldn’t capture That bright infinity inside your eyes  매일 밤 네게 날아가 (가) 꿈이란 것도 잊은 채 나 웃으며 너를 만나 (나) Never ending forever baby  You, you are my universe and I just want to put you first And you, you are my universe, and You make my world light up inside  어둠이 내겐 더 편했었지 길어진 그림자 속에서 (eyes)  And they said that we can’","Hey, hey, hey, hey For some reason, we're loyal, loyal To the beat inside. Hey, hey, hey, hey, hey For some reason, we're loyal To the beat inside."
c24b8d8b948744438c810f6cb1d0637d,하루 종일 집에 누워서 전화기만 보고 있잖아 내 머릿속은 네 생각들로만 짜여져 있어 날 찾지 않아도 좋아하지 않아도 이제는 느낄 수 있어 바라보지 않아도 다른 사람에게 마음을 줘도 이제는 견딜 수 있어 어두운 방 안에서 혼자 있는 나 그리고 하 네가 불러주지 않아도 난 괜찮아 난 괜찮아 날 찾지 않아도 좋아하지 않아도 이제는 느낄 수 있어 바라보지 않아도 다른 사람에게 마음을 줘도 이제는 견딜 수 있어 어두운 방 안에서 혼자 있는 나 그리고 하 네가 불러주지 않아도 난 괜찮아 난 괜찮아 언젠가는 다시 돌아와 주길 와 주길 언젠가는 꼭 다시 볼 수 있기를 볼 수 있기를 어두운 방 안에서 혼자 있는 나 그리고 하 네가 불러주지 않아도 난 괜찮아 난 괜찮아 어두운 방 안에서 혼자 있는 나 그리고 하 네가 불러주지 않아도 난 괜찮아 난 괜찮아,"I'm just living all alone in my house I'm only looking at your phone All your thoughts are just in my head I can't go anywhere if you don't want me anymore In my room without anyone looking for me, I can feel you even if you don't want me anymore In my room without anyone looking for me, I can feel you even if you don't want me anymore In my room without anyone looking for me, I can feel you even if you don't want me anymore In my room without anyone looking for me, I can feel you even if you don't want me anymore In my room without anyone looking for me, I can feel you even if you don't want me anymore In my room without anyone looking for me, I can feel you even if you don't want me anymore In my room without anyone looking for me, I can feel you even if you don't want me anymore In my room without anyone looking for me, I can feel you even if you don't want me anymore In my room without anyone looking for me, I can feel you even if you don't want me anymore In my room without anyone looking for me, I can feel you even if you don't want me anymore In my room without anyone looking for me, I can feel you even if you don't want me anymore In my room without anyone looking for me, I can feel you even if you don't want me anymore In my room without anyone looking for me, I can feel you even if you don't want me anymore In my room without anyone looking for me, I can feel you even if you don't want me anymore In my room without anyone looking for me, I can feel you even if you don't want me anymore In my room without anyone looking for me, I can feel you even if you don't want me anymore In my room without anyone looking for me, I can feel you even if you don't want me anymore In my room without anyone looking for me, I can feel you even if you don't want me anymore In my room without anyone looking for me, I can feel you even if you don't want me anymore In my room without anyone looking for me, I can feel you even if you don't want me anymore In my room without anyone looking for me, I can feel you even if you don't want me anymore In my room without anyone looking for me, I can feel you even if you don't want me anymore In my room without anyone looking for me, I can feel you"
c24b8d8b948744438c810f6cb1d0637d,내가 너라면 다 알아볼 텐데 널 위할 사람 찾아낼 텐데 지난 오랜 시간 너의 그 곁을 지켜온 나라는 걸 내가 너였다면 참 행복할 텐데 한 사람을 다 가졌으니까 둔한 바보도 눈치챌 그 사랑을 너만 왜 모르니 너를 바라만 바라만 본다 외쳐 네 이름만 부른다 보고 싶은 맘에 너를 향한 그 발걸음 네 곁을 맴도는데 오늘도 그리고 그리워하다 애써 참았던 눈물이 흘러 그저 멀리서만 바라보다 또 소리쳐 네가 보고 싶다 네가 나라면 더 참 아팠을 텐데 슬픈 역할은 내가 맡을게 웃는 모습만 보이며 살아가 줘 내가 볼 수 있게 너를 바라만 바라만 본다 외쳐 네 이름만 부른다 보고 싶은 맘에 너를 향한 그 발걸음 네 곁을 맴도는데 오늘도 그리고 그리워하다 애써 참았던 눈물이 흘러 그저 멀리서만 바라보다 또 소리쳐 네가 보고 싶다 한 걸음 더 다가갈까 더 가까이 네게 갈까 OH 어제보다 더 내일 더 널 사랑해 I’ll make you love me someday 혼자 바라고 바라만 보다 울컥 그리움이 솟는다 바보 같은 맘에,If it was you I would know everything For you I would find a person who would protect you I would be so happy If it was you I would be happy If it was you I would be happy in your heart someone who only knows you more I would smile because I wait with longing eyes but Why do you not know? Because I wait with longing eyes I wait with longing eyes I wait with longing eyes but Why do you not know? Because I wait with longing eyes I wait with longing eyes I wait with longing eyes
c24b8d8b948744438c810f6cb1d0637d,느낌이 오잖아  떨리고 있잖아  언제까지 눈치만 볼 거니  네 맘을 말해봐  딴청 피우지 말란 말이야  네 맘 가는 그대로  지금 내 손을 잡아  어서 내 손을 잡아  우연히 고개를 돌릴 때 마다  눈이 마주치는 건  며칠 밤 내내 꿈속에 나타나  밤새 나를 괴롭히는 건  그 많은 빈자리 중에서 하필  내 옆자릴 고르는 건  나도 모르게 어느새 실없는 웃음  흘리고 있다는 건  그럼 말 다했지 뭐  우리 얘기 좀 할까  느낌이 오잖아 떨리고 있잖아  언제까지 눈치만 볼 거니  네 맘을 말해봐  딴청 피우지 말란 말이야  네 맘 가는 그대로  지금 내 손을 잡아  핸드폰 진동에  심장이 덜컥내려 앉는다는 건  오 나도 모르게  어느새 짓궂은 네 말투  자꾸 듣고 싶은걸  어떡해  저기 멀리 걸어온다  눈이 마주친다  언제까지 넌 모른척 할거니  사랑이 온거야 너와 나 말이야  네가 좋아 정말 못 견딜 만큼  그거면 된거야  더는 생각하지 말란 말이야  네 맘 가는 그대로  느낌이 오잖아 떨리고 있잖아  언,"I’m saying this with a heart pounding I’m going to see you everyday No matter how much you look at me, you’re gonna trust my heart Your heart keeps pounding Are you going to run away? Hold my hand wherever you go Every night, I’m meeting you in my dreams Every night, I’m hearing your words Your eyes that are blending in my heart Every night, I’m hearing your words Your voice keeps flickering before me Every night, I’m hearing your words Your face keeps flickering before me Every night, I’m hearing your words Your voice keeps flickering before me Every night, I’m hearing your words Your voice keeps flickering before me Every night, I’m hearing your words Your voice keeps flickering before me Every night, I’m hearing your words Your voice keeps flickering before me Every night, I’m hearing your words"
c24b8d8b948744438c810f6cb1d0637d,이윽고 내가 한눈에 너를 알아봤을 때 모든 건 분명 달라지고 있었어 내 세상은 널 알기 전과 후로 나뉘어 니가 숨 쉬면 따스한 바람이 불어와 니가 웃으면 눈부신 햇살이 비춰 거기 있어줘서 그게 너라서 가끔 내 어깨에 가만히 기대주어서 나는 있잖아 정말 빈틈없이 행복해 너를 따라서 시간은 흐르고 멈춰 물끄러미 너를 들여다 보곤 해 그것 말고는 아무것도 할 수 없어서 너의 모든 순간 그게 나였으면 좋겠다 생각만 해도 가슴이 차올라 나는 온통 너로 보고 있으면 왠지 꿈처럼 아득한 것 몇 광년 동안 날 향해 날아온 별빛 또 지금의 너 거기 있어줘서 그게 너라서 가끔 나에게 조용하게 안겨주어서 나는 있잖아 정말 남김없이 고마워 너를 따라서 시간은 흐르고 멈춰 물끄러미 너를 들여다보곤 해 너를 보는 게 나에게는 사랑이니까 너의 모든 순간 그게 나였으면 좋겠다 생각만 해도 가슴이 차올라 나는 온통 너로 니 모든 순간 나였으면,"I’ve been staring at you for a while now But everything in between seemed so clear When I opened my eyes in the morning, the world changed Feels like I’ve known you all along And when I breathe warmly and clear in the sunshine, Feels like I’ve been waiting for a while now When I open my eyes in the morning, the world changed Feels like I’ve known you all along And when I breathe warmly and clear in the sunshine, Feels like I’ve been waiting for a while now But I hold your head sadly And it’s so amazing"
c24b8d8b948744438c810f6cb1d0637d,"Uh, You wanna feel the vibe That I’m feeling and loving it and imagining 저기 멀리 Looks like tiny we call it's destiny 지금부터 하나 둘 셋 하면 모여보자 그래 Come over Yeah, Get it on nah Get in on nah Let’s bring back to 90’s  내가 원하는 대로 자신 있는 모습 그대로 이제껏 숨겨 왔던 비밀을 네게 모두 말하고 싶어 Baby  Funny how all dreams come true (My dreams come true) 나를 지켜줄 거야 아껴왔던 작은 사랑도 (You make me feel so good) Funny how I feel for you 너의 곁에 그려질 꿈결같은 나의 미래도 (You gotta be mine 지금도 미래도)  You make it feel me good Do you wanna upside down You make it feel me","Hey, hey, hey, hey Baby, hey! Yeah, yeah, yeah, yeah. Hey, hey, hey, hey, hey, hey, hey. Yeah, yeah, yeah, yeah, yeah. Hey, hey, hey, hey, hey, hey. Hey, hey, hey, hey, hey. Hey, hey, hey, hey."
c24b8d8b948744438c810f6cb1d0637d,서로를 향한 마음이 우주의 작은 뭉쳐짐이라면 이 아름다운 기억이 흩어져도 사라지진 않을 거야 잠들지 못한 바람은 고요히 빛나는 너의 바다로 그 안에 잠겨 죽어도 좋으니 나 네 품에 안겨 너의 이름이 긴 밤을 지나 찰나가 영원이 될 때 얼마나 내가 널 좋아하면 달에 네 목소리가 보여 오색 빛 하늘 별 숲 사이로 너라는 꽃이 피어나 그 세상의 반을 가진다 해도 그저 네 앞에선 꽃에 머물고픈 한 남자일 뿐 오롯이 나를 비춰요 어둠이 드리워도 눈이 부시게 눈물조차 반짝이는 밤의 기적을 노래하네 너의 이름이 긴 밤을 지나 찰나가 영원이 될 때 얼마나 내가 널 좋아하면 달에 네 목소리가 보여 오색 빛 하늘 별 숲 사이로 너라는 꽃이 피어나 그 세상의 반을 가진다 해도 그저 네 앞에선 꽃에 머물고픈 남자일 뿐 밤 하늘 수놓인 모든 것들이 운명 위로 내리는 걸 내 꿈에 안긴 널 한 번 더 가득히 안아 시간을 넘어 빛이 닿는 세계의 바깥까지 함께 너의 깊은 미소의 황홀 속 일렁임은 영원과 이어질 거야 얼마나 내가 널 원,"If our hearts become galaxies, if our feelings scatter I won't disappear even if this beautiful memory fills the ocean Likewise, the wind of your softly blowing sea can't melt I want to be under your sea's own name If I can live in your heart for a long time, then I can be reborn in your arms If I can live in your heart for a long time, then I can draw you from your light In the midst of the black night sky, in the midst of the black stars You whom I love so desperately, I can draw you from your heart If I can live in your heart for a long time, then I can draw you from your light In the midst of the black night, in the midst of the black stars You whom I love so desperately, I can draw you from your heart"
c24b8d8b948744438c810f6cb1d0637d,"You know without you I’m so lonely When you’re not here 911 calling Into your heat again I’m diving Darling you Darling you baby  Fighting round in circles where is the way out ‘Cause I know that our love was hotter than the sun Yeah the taste of this tequila I’m drinking now Isn’t bitter than my heart  (If you know this) I want to know our problem blood type or DNA Friends see my feed and worry, do you babe? Yeah Been waiting for your call every night But I can’t wait no more Dialing you-u-u, sorry darling",I wanna be your mermaid (uh) I wanna be your mermaid (uh) Yeah! I wanna be your mermaid (uh) Yeah! I wanna be your mermaid (uh)
c24b8d8b948744438c810f6cb1d0637d,Trust the warmth inside Can you feel my love alive 어제처럼 오늘도 아무 일 없는 듯이 그리고 Please don't tell me why 이렇게 돌아서지만 나를 떠나가는 이유를 난 묻진 않을게요 내게 이런 말 하기가 쉽진 않았을 거야 생각해 봤어 얼마나 어려웠을지 다만 슬픈 내 눈물에 돌아설 수 없어 멈출 사랑으로 안을까 봐 난 너무나 두려울 뿐이죠 So baby Trust the warmth inside Can you feel my love alive 어제처럼 오늘도 아무 일 없는 듯이 그리고 Please don't tell me why 이렇게 돌아서지만 나를 떠나가는 이유를 난 묻진 않을게요 네겐 너무나 부족한 나를 알고 있기에 다짐해 왔어 언젠가 이별이 오면 그땐 떠난 내 마음이 미안하지 않게 좋은 추억으로 간직하게 널 웃으며 보내준다고 Faith is all we need It was love that set us free 처음처럼 이별은 아무런 얘기 없이,"And as you move on, I feel your heartbeat pumping. And it's as if you never did it. And it's as if you never did it. And it's like you never did it. And it's like you never did it. And I'm not saying goodbye. I just don't know why I'm so anxious."
